<?xml version="1.0" encoding="UTF-8"?>
<cprovl:POLICY xmlns:cprov="http://labs.orange.com/uk/cprov#" xmlns:cprovl="http://labs.orange.com/uk/cprovl#"
	xmlns:prov="http://www.w3.org/ns/prov#" xmlns:cprovd="http://labs.orange.com/uk/cprovd#"
	xmlns:r="http://labs.orange.com/uk/r#" xmlns:cu="http://www.w3.org/1999/xhtml/datatypes/"
	xmlns:confidenshare="http://labs.orange.com/uk/confidenshare#" xmlns:opmx="http://openprovenance.org/model/opmx#"
	xmlns:xsi="http://www.w3.org/2001/XMLSchema-instance" xsi:schemaLocation="http://labs.orange.com/uk/cprovl#
	file:/Users/mufy/Dropbox/EngD/year3/schema/cProvl/cProvl-v1.1.xsd">
	
	<cprovl:entity prov:id="confidenshare:policy8">
		<cprovl:description>
			A system cannot replicate a file, if the user explicitly marks during the creation
			of a file as non-replicable
		</cprovl:description>
	</cprovl:entity>
	
	<cprovl:ENV>
		<cprovl:entity prov:id="confidenshare:rep.store.confidenshare.labs.orange.com">
			<cprovl:description/>
		</cprovl:entity>
	</cprovl:ENV>
	
	<cprovl:RULE>
		<cprovl:entity prov:id="confidenshare:rule1">
			<cprovl:description>
			</cprovl:description>
		</cprovl:entity>
		<cprovl:DEF>
			<cprovl:entity prov:id="confidenshare:def">
				<cprovl:range>cprovd:All</cprovl:range>
			</cprovl:entity>
		</cprovl:DEF>
		<cprovl:IF cprovl:quantifier="cprovd:There-exist">
			
			<!-- Check for the request resource -->
			<cprovl:target>
				<cprovl:ID cprovl:var_type="cprovd:d-ref" cprovl:category_type="cprovd:Resource">r:e001</cprovl:ID>
			</cprovl:target>
			<!-- Check for the process replication -->
			<cprovl:target>
				<cprovl:ID cprovl:var_type="cprovd:d-ref" cprovl:category_type="cprovd:Action">confidenshare:replicate</cprovl:ID>
			</cprovl:target>
			
		</cprovl:IF>
		<cprovl:SUCH-THAT>
			<cprovl:statements>
				
				<!-- Check if the resource is replicable -->
				<cprovl:statement>
					<cprov:cResource prov:id="r:e001">
						<cprov:isReplicable>true</cprov:isReplicable>
					</cprov:cResource>
				</cprovl:statement>
				
			</cprovl:statements>
		</cprovl:SUCH-THAT>
		<cprovl:THEN>
			<cprovl:entity prov:id="confidenshare:result">
				<cprovl:actionType>cprovd:Permit</cprovl:actionType>
				<cprovl:resourceId>confidenshare:replicate</cprovl:resourceId>
			</cprovl:entity>
			<cprov:hadOwnership>
				<prov:entity prov:ref="confidenshare:result" />
				<prov:agent prov:ref="r:ag001" />
				<cprov:ownershipType>cprovd:possession</cprov:ownershipType>
			</cprov:hadOwnership>
		</cprovl:THEN>
	</cprovl:RULE>
	
	<cprovl:RULE>
		<cprovl:entity>
			<cprovl:description>Otherwise deny all</cprovl:description>
		</cprovl:entity>
		<cprovl:DEF>
			<cprovl:entity>
				<cprovl:range>cprovd:All</cprovl:range>
			</cprovl:entity>
		</cprovl:DEF>
		<cprovl:IF cprovl:quantifier="cprovd:There-exist">
			<cprovl:target>
				<cprovl:ID cprovl:var_type="cprovd:s-ref" cprovl:var_identifier="r:ag001" cprovl:category_type="cprovd:Subject">r:ag001</cprovl:ID>
			</cprovl:target>
		</cprovl:IF>
		<cprovl:THEN>
			<cprovl:entity prov:id="confidenshare:result">
				<cprovl:actionType>cprovd:Deny</cprovl:actionType>
				<cprovl:resourceId>confidenshare:share</cprovl:resourceId>
			</cprovl:entity>
			<cprov:hadOwnership>
				<prov:entity prov:ref="confidenshare:result" />
				<prov:agent prov:ref="r:ag001" />
				<cprov:ownershipType>cprovd:possession</cprov:ownershipType>
			</cprov:hadOwnership>
		</cprovl:THEN>
	</cprovl:RULE>
</cprovl:POLICY>
